{
  "$schema": "https://json-schema.org/draft/2020-12/schema",
  "$id": "https://forge.dev/schemas/roadmap/roadmap.schema.json",
  "title": "Forge Roadmap",
  "description": "A versioned, commit-able plan. Runtime state is kept separately under .forge/runtime/.",
  "type": "object",
  "additionalProperties": false,
  "required": ["schema_version", "roadmap_id", "project_id", "version", "sprints"],
  "properties": {
    "schema_version": { "type": "string", "const": "1.0" },
    "roadmap_id": { "type": "string" },
    "project_id": { "type": "string" },
    "version": { "type": "string" },
    "goals": { "type": "array", "items": { "type": "string" } },
    "sprints": { "type": "array", "items": { "$ref": "https://forge.dev/schemas/roadmap/sprint.schema.json" }, "minItems": 1 },
    "constraints": { "type": "array", "items": { "type": "string" } }
  }
}
